Index,Name,Lastname,Adress,Phone,Zipcode
2,Мария,Федотов,"Россия, Киров, проспект, Самара, 476418",(987)866-28-80,168294
3,Денис,Филиппова,"Россия, Тюмень, пл., Киров, 925632",(982)106-66-92,096011
4,Анна,Никонов,"Россия, Пермь, площадь, Сочи, 525502",(948)617-49-16,865116
5,Ульяна,Овчинников,"Россия, Чебоксары, пр., Ярославль, 930442",(902)144-03-82,059906
6,Ульяна,Титов,"Россия, Омск, пл., Тула, 390611",(945)232-71-65,300878
7,Геннадий,Лыткин,"Россия, Москва, пл., Казань, 010171",(986)528-84-98,374696
8,Людмила,Сазонов,"Россия, Тула, пр., Ярославль, 165328",(949)311-62-55,414185
9,Константин,Крылова,"Россия, Москва, проспект, Курск, 592988",(948)353-43-46,992634
10,Борис,Моисеев,"Россия, Иваново, проспект, Киров, 166588",(923)560-59-14,190305
11,Борис,Захаров,"Россия, Пенза, площадь, Тольятти, 243647",(911)157-37-40,073674
12,Фёдор,Меркушева,"Россия, Ярославль, ул., Барнаул, 906398",(946)096-08-73,951533
13,Анатолий,Самсонов,"Россия, Томск, площадь, Курск, 477501",(908)626-67-90,520107
14,Марина,Костина,"Россия, Томск, пр., Воронеж, 790197",(924)821-52-64,410440
15,Станислав,Фомичева,"Россия, Краснодар, улица, Екатеринбург, 733065",(944)013-14-98,791908
16,Владимир,Мельников,"Россия, Уфа, ул., Сочи, 484905",(923)602-62-51,917630
17,Жанна,Харитонова,"Россия, Нижний Новгород, пр., Нижний Новгород, 298506",(905)292-93-39,022124
18,Александр,Павлов,"Россия, Тольятти, проспект, Ростов-на-Дону, 077503",(981)373-03-69,758227
19,Анастасия,Ковалева,"Россия, Ульяновск, пр., Тольятти, 565749",(964)106-84-98,103129
20,Артём,Ковалева,"Россия, Пенза, пр., Тула, 127743",(967)828-24-52,501526
21,Борис,Щукин,"Россия, Иваново, проспект, Екатеринбург, 654962",(963)871-50-29,771548
22,Станислав,Смирнов,"Россия, Курск, площадь, Тюмень, 324840",(971)197-17-05,809903
23,Вадим,Никифоров,"Россия, Липецк, улица, Тверь, 434775",(921)443-07-25,024353
24,Константин,Силина,"Россия, Томск, пр., Пермь, 373074",(940)707-05-55,140014
25,Евгения,Морозова,"Россия, Тула, ул., Уфа, 240351",(903)435-05-22,018037
26,Алина,Рябов,"Россия, Киров, площадь, Тольятти, 067253",(968)671-78-21,420920
27,Денис,Некрасова,"Россия, Барнаул, пр., Махачкала, 634730",(917)093-53-43,094387
28,Валерия,Лапина,"Россия, Волгоград, пл., Чебоксары, 707861",(991)229-36-02,912469
29,Варвара,Суворов,"Россия, Пермь, ул., Владивосток, 358154",(968)483-63-47,145960
30,Любовь,Кабанова,"Россия, Санкт-Петербург, ул., Пенза, 816497",(989)869-16-45,217493
31,Лаврентий,Родионова,"Россия, Астрахань, пл., Кемерово, 286253",(980)517-79-23,570973
32,Евгения,Кононова,"Россия, Ярославль, улица, Иваново, 618835",(964)171-19-76,087411
33,Лидия,Шаров,"Россия, Саратов, пр., Иваново, 936525",(944)815-43-34,410403
34,Александр,Сергеев,"Россия, Чебоксары, ул., Махачкала, 308302",(932)138-84-45,589217
35,Виктория,Дьячкова,"Россия, Рязань, проспект, Санкт-Петербург, 598502",(945)061-21-53,504790
36,Анжела,Овчинников,"Россия, Ульяновск, улица, Ростов-на-Дону, 105166",(921)057-13-72,494909
37,Владимир,Туров,"Россия, Рязань, проспект, Барнаул, 372535",(984)200-38-29,618175
38,Алла,Чернов,"Россия, Хабаровск, улица, Иваново, 665560",(974)000-01-13,832097
39,Жанна,Кузьмина,"Россия, Барнаул, улица, Курск, 797235",(992)176-94-81,248738
40,Оксана,Панова,"Россия, Воронеж, пл., Омск, 193640",(970)802-27-11,874972
41,Анжелика,Соколова,"Россия, Липецк, площадь, Волгоград, 355406",(960)738-41-52,900352
42,Геннадий,Ермакова,"Россия, Екатеринбург, проспект, Липецк, 668012",(909)379-86-99,124013
43,Ксения,Борисов,"Россия, Рязань, площадь, Самара, 289485",(975)689-07-67,167191
44,Даниил,Алексеева,"Россия, Киров, улица, Владимир, 727234",(978)441-40-39,100458
45,Фёдор,Филиппов,"Россия, Тверь, улица, Барнаул, 251037",(936)186-23-57,978048
46,Валентина,Жданова,"Россия, Ставрополь, площадь, Пенза, 937222",(965)509-40-40,850045
47,Матвей,Никитина,"Россия, Новосибирск, ул., Тольятти, 672312",(922)571-11-61,269868
48,Владимир,Калинин,"Россия, Рязань, проспект, Сочи, 131571",(952)068-35-51,555973
49,Григорий,Кондратьева,"Россия, Уфа, площадь, Белгород, 628710",(976)161-82-02,551916
50,Алевтина,Наумова,"Россия, Уфа, пр., Санкт-Петербург, 302763",(911)667-61-40,023173
51,Наталья,Горшков,"Россия, Чебоксары, пл., Ставрополь, 142081",(929)551-22-28,086401
52,Анастасия,Виноградова,"Россия, Казань, площадь, Пермь, 506673",(964)063-71-25,945296
53,Арсений,Крюков,"Россия, Екатеринбург, улица, Иркутск, 314456",(989)456-22-80,906827
54,Борис,Быкова,"Россия, Ростов-на-Дону, ул., Самара, 304067",(988)370-12-76,573505
55,Ульяна,Савина,"Россия, Липецк, пл., Курск, 056369",(991)736-31-53,318291
56,Сергей,Пестова,"Россия, Владивосток, пл., Томск, 460604",(981)254-78-54,695652
57,Тамара,Зуева,"Россия, Чебоксары, улица, Пермь, 312474",(930)255-88-80,181329
58,Анжела,Власова,"Россия, Челябинск, проспект, Киров, 397265",(900)049-64-99,341019
59,Ирина,Блинов,"Россия, Курск, проспект, Липецк, 535483",(916)948-80-17,399628
60,Константин,Кириллова,"Россия, Хабаровск, площадь, Иркутск, 436797",(975)168-43-40,771097
61,Алёна,Князев,"Россия, Иркутск, улица, Санкт-Петербург, 663358",(962)454-89-34,647919
62,Мария,Зимин,"Россия, Ульяновск, проспект, Ижевск, 126363",(980)045-88-81,705894
63,Алла,Белоусова,"Россия, Махачкала, площадь, Махачкала, 475411",(918)556-62-96,710883
64,Георгий,Сорокина,"Россия, Нижний Новгород, ул., Белгород, 430451",(928)666-85-57,103382
65,Ирина,Зиновьев,"Россия, Хабаровск, проспект, Магнитогорск, 084181",(938)432-99-05,179034
66,Валерия,Бобров,"Россия, Ростов-на-Дону, пр., Новосибирск, 803218",(995)013-37-88,517376
67,Александра,Титова,"Россия, Омск, ул., Уфа, 985498",(955)340-64-66,186708
68,Ольга,Александрова,"Россия, Чебоксары, пр., Ростов-на-Дону, 896610",(916)040-01-35,061281
69,Анжела,Доронина,"Россия, Тула, площадь, Омск, 304677",(956)589-78-00,658959
70,Марина,Бобылев,"Россия, Тула, ул., Ярославль, 910649",(902)781-12-52,417445
Evaluation Only. Created with Aspose.Cells for .NET.Copyright 2003 - 2024 Aspose Pty Ltd.